{
  "schema_version": 4,
  "criterion": "thirdpass-full-crate-archive-reviewed/v1",
  "coverage_type": "thirdpass full crate archive manifest coverage",
  "method": "Generated from approved Thirdpass reviews matching review_scope=target_file_full, agent_name=codex, agent_model=gpt-5.4-mini, agent_reasoning_effort=high. A crate version is emitted when the matching review records cover every regular file in the authoritative crates.io package archive manifest with complete file, line, and byte coverage and zero pending or unreviewed manifest work.",
  "review_filter": {
    "review_scope": "target_file_full",
    "agent_name": "codex",
    "agent_model": "gpt-5.4-mini",
    "agent_reasoning_effort": "high"
  },
  "procedure": {
    "id": "file-focused-review",
    "version": "v1",
    "reference": "file-focused-review/v1",
    "name": "File-focused review",
    "file": "procedures/file-focused-review-v1.md",
    "docs_url": "https://thirdpass.dev/docs/cargo-vet#file-focused-review"
  },
  "exporter": {
    "name": "Thirdpass coverage export",
    "version": "0.1.0",
    "source_api_base": "https://thirdpass.dev/api"
  },
  "review_page_url": "https://thirdpass.dev/reviews/crates.io/writeable/0.6.3",
  "package": {
    "registry_host": "crates.io",
    "package_name": "writeable",
    "package_version": "0.6.3",
    "package_hash": "243a3a82bfd62de0255c86c5e70d1ce7b538d0868724e9891b7bd8603e241973"
  },
  "coverage": {
    "has_authoritative_manifest": true,
    "files": {
      "total": 20,
      "reviewed": 20,
      "pending": 0,
      "unreviewed": 0,
      "reviewed_percent": 100.0
    },
    "lines": {
      "total": 2883,
      "reviewed": 2883,
      "pending": 0,
      "unreviewed": 0,
      "reviewed_percent": 100.0
    },
    "bytes": {
      "total": 110780,
      "reviewed": 110780,
      "pending": 0,
      "unreviewed": 0,
      "reviewed_percent": 100.0
    }
  },
  "highest_severity": "none",
  "latest_reviewed_at": "1784058623",
  "latest_agent_name": "codex",
  "latest_agent_model": "gpt-5.4-mini",
  "latest_agent_reasoning_effort": "high",
  "manifest": {
    "authoritative": true,
    "files": [
      {
        "path": ".cargo_vcs_info.json",
        "file_hash": {
          "algorithm": "blake3",
          "value": "85031290e5bfa794f5022fcfe621a00407b020500289d1175d36b54160d7c98e"
        },
        "size_bytes": 109,
        "extension": "json",
        "line_count": 6
      },
      {
        "path": "Cargo.lock",
        "file_hash": {
          "algorithm": "blake3",
          "value": "4258973805499027ad46985ccecbeaf530a37694942ea763ec5850b2028373d4"
        },
        "size_bytes": 16259,
        "extension": "lock",
        "line_count": 633
      },
      {
        "path": "Cargo.toml",
        "file_hash": {
          "algorithm": "blake3",
          "value": "1ff2515592f21cfe874eb0756d2d430fc9d827a436f557b5236800158c67ab28"
        },
        "size_bytes": 3104,
        "extension": "toml",
        "line_count": 134
      },
      {
        "path": "Cargo.toml.orig",
        "file_hash": {
          "algorithm": "blake3",
          "value": "9fc984ef6b42d494ad63147c11e290f54428584c168cf93e797670cf9552eb61"
        },
        "size_bytes": 1114,
        "extension": "orig",
        "line_count": 48
      },
      {
        "path": "LICENSE",
        "file_hash": {
          "algorithm": "blake3",
          "value": "4ce40d3c43ba50365f37d4c3676f6c0c2be24a2175f6b36bae13cee04ffea44c"
        },
        "size_bytes": 2195,
        "line_count": 46
      },
      {
        "path": "README.md",
        "file_hash": {
          "algorithm": "blake3",
          "value": "687375372dad8d3ae9a1c4a2b3a0b9d96dd7613a24330fd4f049f2288dc42e25"
        },
        "size_bytes": 2181,
        "extension": "md",
        "line_count": 37
      },
      {
        "path": "benches/writeable.rs",
        "file_hash": {
          "algorithm": "blake3",
          "value": "c151a3d7ce3518a8a5d08d193ae34a7c36fded0342d390aea1a415097389aac9"
        },
        "size_bytes": 9501,
        "extension": "rs",
        "line_count": 312
      },
      {
        "path": "examples/writeable_message.rs",
        "file_hash": {
          "algorithm": "blake3",
          "value": "82caf183723afc30fc0fa0c9cdb595b94acfad739db27296e947b5a8a8b1f718"
        },
        "size_bytes": 1651,
        "extension": "rs",
        "line_count": 60
      },
      {
        "path": "src/cmp.rs",
        "file_hash": {
          "algorithm": "blake3",
          "value": "445d871e5f319965feb6218a1c4582bd3ee89a6eaeefeb35dcf8f5e16f4d1074"
        },
        "size_bytes": 5235,
        "extension": "rs",
        "line_count": 112
      },
      {
        "path": "src/concat.rs",
        "file_hash": {
          "algorithm": "blake3",
          "value": "9fca875f8517bc16c98daeaff82646689626dd38618f2ce0ea4cb5d2456c526d"
        },
        "size_bytes": 4054,
        "extension": "rs",
        "line_count": 90
      },
      {
        "path": "src/either.rs",
        "file_hash": {
          "algorithm": "blake3",
          "value": "ed35a673859fddd61f56d4ea8d07299905fa5105ff283b2197cee75945ac3dbf"
        },
        "size_bytes": 1468,
        "extension": "rs",
        "line_count": 48
      },
      {
        "path": "src/impls.rs",
        "file_hash": {
          "algorithm": "blake3",
          "value": "2b454abe2d90ddb96c682ecca86996769473b38192c3452c95d4720bcc50432f"
        },
        "size_bytes": 9134,
        "extension": "rs",
        "line_count": 275
      },
      {
        "path": "src/lib.rs",
        "file_hash": {
          "algorithm": "blake3",
          "value": "388c0ad742c61144550f64768c84710cd238b23e514a5fa464d51432dc8344aa"
        },
        "size_bytes": 17619,
        "extension": "rs",
        "line_count": 251
      },
      {
        "path": "src/ops.rs",
        "file_hash": {
          "algorithm": "blake3",
          "value": "f5a2e2c1db38f953ad718b138652b64f39c4a5d01e15d0a4ecb66932541e9cd0"
        },
        "size_bytes": 7877,
        "extension": "rs",
        "line_count": 268
      },
      {
        "path": "src/parts_write_adapter.rs",
        "file_hash": {
          "algorithm": "blake3",
          "value": "610981e47dfcad55486418de2963bfb5bc1a69a46ad80a56bcd81b779047e597"
        },
        "size_bytes": 3018,
        "extension": "rs",
        "line_count": 75
      },
      {
        "path": "src/testing.rs",
        "file_hash": {
          "algorithm": "blake3",
          "value": "2f1f7c396492aac3c5c761c04de1456957a1b05f7b40a200c7e7dc427d558250"
        },
        "size_bytes": 2282,
        "extension": "rs",
        "line_count": 79
      },
      {
        "path": "src/to_string_or_borrow.rs",
        "file_hash": {
          "algorithm": "blake3",
          "value": "62bfce9c0219d1422b8fe36c414ca237f605c285f89fb19d88cf1296348f0421"
        },
        "size_bytes": 7206,
        "extension": "rs",
        "line_count": 99
      },
      {
        "path": "src/try_writeable.rs",
        "file_hash": {
          "algorithm": "blake3",
          "value": "5528309381a9403b75b79d2beffbd1de7d722c16d4bac28c92cc0dda33f8c785"
        },
        "size_bytes": 15233,
        "extension": "rs",
        "line_count": 251
      },
      {
        "path": "tests/data/data.rs",
        "file_hash": {
          "algorithm": "blake3",
          "value": "9160d8f1e76c156d538fcff7e1bbeeade5936c9dbe2d42e5935e3af973d29e69"
        },
        "size_bytes": 611,
        "extension": "rs",
        "line_count": 26
      },
      {
        "path": "tests/writeable.rs",
        "file_hash": {
          "algorithm": "blake3",
          "value": "f9b20c3aeed641bca95c2501f83860dcbb01bfe3db6c3c578912ed4b48049166"
        },
        "size_bytes": 929,
        "extension": "rs",
        "line_count": 33
      }
    ]
  },
  "reviewed_files": [
    ".cargo_vcs_info.json",
    "Cargo.lock",
    "Cargo.toml",
    "Cargo.toml.orig",
    "LICENSE",
    "README.md",
    "benches/writeable.rs",
    "examples/writeable_message.rs",
    "src/cmp.rs",
    "src/concat.rs",
    "src/either.rs",
    "src/impls.rs",
    "src/lib.rs",
    "src/ops.rs",
    "src/parts_write_adapter.rs",
    "src/testing.rs",
    "src/to_string_or_borrow.rs",
    "src/try_writeable.rs",
    "tests/data/data.rs",
    "tests/writeable.rs"
  ],
  "agent_runs": [
    {
      "agent_name": "codex",
      "agent_model": "gpt-5.4-mini",
      "agent_reasoning_effort": "high",
      "review_count": 6,
      "file_record_count": 25,
      "file_record_count_with_metrics": 25
    }
  ],
  "agent_run_metrics_summary": {
    "reviewed_file_records": 25,
    "file_records_with_metrics": 25,
    "file_records_without_metrics": 0,
    "duration_ms_total": 410672,
    "attempts_total": 25,
    "failed_attempt_duration_ms_total": 0,
    "retry_wait_ms_total": 0,
    "retry_reason_count": 0,
    "total_token_usage_records": 25,
    "last_token_usage_records": 25,
    "total_token_usage": {
      "input_tokens": 793558,
      "cached_input_tokens": 691456,
      "output_tokens": 12257,
      "reasoning_output_tokens": 6179,
      "total_tokens": 805815
    },
    "last_token_usage": {
      "input_tokens": 793558,
      "cached_input_tokens": 691456,
      "output_tokens": 12257,
      "reasoning_output_tokens": 6179,
      "total_tokens": 805815
    },
    "model_context_windows": []
  },
  "reviews": [
    {
      "id": "rev_168cbfbd015b4d35a683b5968145b283",
      "public_user_id": "d7d85a95-49ea-818b-aa46-7dff97fe9263",
      "reviewer": {
        "public_user_id": "d7d85a95-49ea-818b-aa46-7dff97fe9263",
        "official": true
      },
      "agent_name": "codex",
      "agent_model": "gpt-5.4-mini",
      "agent_reasoning_effort": "high",
      "review_strategy": "file-focused-review/v1",
      "review_scope": "target_file_full",
      "created_at": "1784052397",
      "thirdpass_version": "0.6.0",
      "files": [
        {